adrian@ES-PF345JLV:~/projects/dns_latency_post$ ./dns_latency.sh 
-- Hostto check: playboy.com
   Protocol: udp
   Port: 53

-- Provider: Local_Default_Gateway
-- Provider IP: 172.21.192.1

- Test 1 - Discarding this first test from the computation
  Query packet: 21:00:31.896093 IP 172.21.206.185.58484 > 172.21.192.1.53: 48526+ A? playboy.com. (29)
  Reply packet: 21:00:31.945733 IP 172.21.192.1.53 > 172.21.206.185.58484: 48526- 2/0/0 A 104.18.13.87, A 104.18.12.87 (72)
  Response time is: 49.640000 milliseconds
- Test 2
  Query packet: 21:00:40.104673 IP 172.21.206.185.59849 > 172.21.192.1.53: 61474+ A? playboy.com. (29)
  Reply packet: 21:00:40.105969 IP 172.21.192.1.53 > 172.21.206.185.59849: 61474- 2/0/0 A 104.18.13.87, A 104.18.12.87 (72)
  Response time is: 1.296000 milliseconds
- Test 3
  Query packet: 21:00:48.026210 IP 172.21.206.185.54540 > 172.21.192.1.53: 10889+ A? playboy.com. (29)
  Reply packet: 21:00:48.027218 IP 172.21.192.1.53 > 172.21.206.185.54540: 10889- 2/0/0 A 104.18.13.87, A 104.18.12.87 (72)
  Response time is: 1.008000 milliseconds

==> Average Local_Def_Gw response time: 1.152 milliseconds

-- Provider: Google
-- Provider IP: 8.8.8.8

- Test 1 - Discarding this first test from the computation
  Query packet: 21:00:55.595384 IP 172.21.206.185.53424 > 8.8.8.8.53: 48997+ A? playboy.com. (29)
  Reply packet: 21:00:55.638193 IP 8.8.8.8.53 > 172.21.206.185.53424: 48997 2/0/0 A 104.18.12.87, A 104.18.13.87 (61)
  Response time is: 42.809000 milliseconds
- Test 2
  Query packet: 21:01:03.216501 IP 172.21.206.185.55377 > 8.8.8.8.53: 52981+ A? playboy.com. (29)
  Reply packet: 21:01:03.245977 IP 8.8.8.8.53 > 172.21.206.185.55377: 52981 2/0/0 A 104.18.13.87, A 104.18.12.87 (61)
  Response time is: 29.476000 milliseconds
- Test 3
  Query packet: 21:01:11.335875 IP 172.21.206.185.57110 > 8.8.8.8.53: 39789+ A? playboy.com. (29)
  Reply packet: 21:01:11.367564 IP 8.8.8.8.53 > 172.21.206.185.57110: 39789 2/0/0 A 104.18.12.87, A 104.18.13.87 (61)
  Response time is: 31.689000 milliseconds

==> Average Google response time: 30.5825 milliseconds

-- Provider: Cloudflare
-- Provider IP: 1.1.1.1

- Test 1 - Discarding this first test from the computation
  Query packet: 21:01:18.775985 IP 172.21.206.185.36996 > 1.1.1.1.53: 57420+ A? playboy.com. (29)
  Reply packet: 21:01:18.828241 IP 1.1.1.1.53 > 172.21.206.185.36996: 57420 2/0/0 A 104.18.12.87, A 104.18.13.87 (61)
  Response time is: 52.256000 milliseconds
- Test 2
  Query packet: 21:01:26.977572 IP 172.21.206.185.54327 > 1.1.1.1.53: 42438+ A? playboy.com. (29)
  Reply packet: 21:01:27.002411 IP 1.1.1.1.53 > 172.21.206.185.54327: 42438 2/0/0 A 104.18.12.87, A 104.18.13.87 (61)
  Response time is: 24.839000 milliseconds
- Test 3
  Query packet: 21:01:34.847349 IP 172.21.206.185.49747 > 1.1.1.1.53: 23920+ A? playboy.com. (29)
  Reply packet: 21:01:34.868792 IP 1.1.1.1.53 > 172.21.206.185.49747: 23920 2/0/0 A 104.18.13.87, A 104.18.12.87 (61)
  Response time is: 21.443000 milliseconds

==> Average Cloudflare response time: 23.141 milliseconds

-- Provider: Cloudflare-Block
-- Provider IP: 1.1.1.3

- Test 1 - Discarding this first test from the computation
  Query packet: 21:01:42.467458 IP 172.21.206.185.58809 > 1.1.1.3.53: 53380+ A? playboy.com. (29)
  Reply packet: 21:01:42.523670 IP 1.1.1.3.53 > 172.21.206.185.58809: 53380 1/0/0 A 0.0.0.0 (45)
  Response time is: 56.212000 milliseconds
- Test 2
  Query packet: 21:01:50.748871 IP 172.21.206.185.37584 > 1.1.1.3.53: 51644+ A? playboy.com. (29)
  Reply packet: 21:01:50.772304 IP 1.1.1.3.53 > 172.21.206.185.37584: 51644 1/0/0 A 0.0.0.0 (45)
  Response time is: 23.433000 milliseconds
- Test 3
  Query packet: 21:01:58.749102 IP 172.21.206.185.52436 > 1.1.1.3.53: 28396+ A? playboy.com. (29)
  Reply packet: 21:01:58.772771 IP 1.1.1.3.53 > 172.21.206.185.52436: 28396 1/0/0 A 0.0.0.0 (45)
  Response time is: 23.669000 milliseconds

==> Average Cloudflare-Block response time: 23.551 milliseconds

-- Provider: OpenDNS
-- Provider IP: 208.67.222.222

- Test 1 - Discarding this first test from the computation
  Query packet: 21:02:06.228254 IP 172.21.206.185.43086 > 208.67.222.222.53: 55161+ A? playboy.com. (29)
  Reply packet: 21:02:06.265973 IP 208.67.222.222.53 > 172.21.206.185.43086: 55161 2/0/0 A 104.18.12.87, A 104.18.13.87 (61)
  Response time is: 37.719000 milliseconds
- Test 2
  Query packet: 21:02:13.789224 IP 172.21.206.185.39575 > 208.67.222.222.53: 37628+ A? playboy.com. (29)
  Reply packet: 21:02:13.821246 IP 208.67.222.222.53 > 172.21.206.185.39575: 37628 2/0/0 A 104.18.13.87, A 104.18.12.87 (61)
  Response time is: 32.022000 milliseconds
- Test 3
  Query packet: 21:02:21.348316 IP 172.21.206.185.33306 > 208.67.222.222.53: 19511+ A? playboy.com. (29)
  Reply packet: 21:02:21.376665 IP 208.67.222.222.53 > 172.21.206.185.33306: 19511 2/0/0 A 104.18.12.87, A 104.18.13.87 (61)
  Response time is: 28.349000 milliseconds

==> Average OpenDNS response time: 30.1855 milliseconds